{
  "meta": {
    "title": "Родословная культур и народов Америки",
    "schema": "schema/genealogy.schema.json",
    "license": "CC BY 4.0",
    "notes": [
      "Перенесено из americas-peoples-graph.html без изменения содержания. Источники ещё не проставлены: поле sources заполняется по мере работы над главами.",
      "Поля dating и certainty выставлены автоматически при переносе: dating — по правилу «до 1500 г. — approx, круглые даты после 1500 г. — conventional, остальные — documented», certainty — по пометке «?» в исходных данных. Требуют проверки.",
      "end: null означает, что народ или общность существует сегодня."
    ]
  },
  "lanes": [
    {
      "id": "root",
      "name": "Общий корень"
    },
    {
      "id": "n",
      "name": "Арктика, Субарктика и Тихоокеанское побережье"
    },
    {
      "id": "ne",
      "name": "Северо-восток и Великие озёра"
    },
    {
      "id": "se",
      "name": "Юго-восток"
    },
    {
      "id": "pl",
      "name": "Великие равнины"
    },
    {
      "id": "sw",
      "name": "Юго-запад, Большой Бассейн и север Мексики"
    },
    {
      "id": "ma",
      "name": "Мезоамерика"
    },
    {
      "id": "sa",
      "name": "Южная Америка и Карибы"
    }
  ],
  "nodes": [
    {
      "id": "paleo",
      "lane": "root",
      "type": "culture",
      "name": "Палеоиндейцы",
      "start": {
        "year": -16000,
        "dating": "conventional"
      },
      "end": {
        "year": -8000,
        "dating": "approx"
      },
      "fate": "ended",
      "parents": [],
      "description": "Первые люди Америки, пришедшие из Северо-Восточной Азии через Берингию. К югу от ледников они, по-видимому, были уже 16–14,5 тыс. лет назад: на это указывают стоянка Купер-Ферри в Айдахо (16,6–15,3 тыс. лет назад) и, независимо от археологии, генетика. Возраст Монте-Верде в Чили с 2026 г. оспорен; следы в Уайт-Сэндс (23–21 тыс. лет) — вероятно, но спорно. Начальная дата на графике условна.",
      "events": [],
      "sources": [
        {
          "ref": "davis2019",
          "loc": "аннотация"
        },
        {
          "ref": "morenomayar2018",
          "loc": "аннотация"
        },
        {
          "ref": "surovell2026",
          "loc": "аннотация"
        },
        {
          "ref": "dillehay2026",
          "loc": "аннотация"
        },
        {
          "ref": "bennett2021",
          "loc": "аннотация"
        },
        {
          "ref": "rhode2024",
          "loc": "аннотация"
        },
        {
          "ref": "holliday2025",
          "loc": "основной текст"
        }
      ]
    },
    {
      "id": "clovis",
      "lane": "root",
      "type": "culture",
      "name": "Кловис",
      "start": {
        "year": -11100,
        "dating": "approx"
      },
      "end": {
        "year": -10800,
        "dating": "approx"
      },
      "fate": "ended",
      "parents": [
        {
          "id": "paleo",
          "certainty": "established"
        }
      ],
      "description": "Охотники на мегафауну с характерными желобчатыми наконечниками. Долго считались «первыми американцами», пока не нашли более ранние стоянки.",
      "events": [],
      "sources": [
        {
          "ref": "waters2020",
          "loc": "аннотация: 13 050–12 750 лет назад"
        }
      ]
    },
    {
      "id": "nwc",
      "lane": "n",
      "type": "culture",
      "name": "Ранние культуры Северо-Западного побережья",
      "start": {
        "year": -8000,
        "dating": "approx"
      },
      "end": {
        "year": 500,
        "dating": "approx"
      },
      "fate": "ended",
      "parents": [
        {
          "id": "paleo",
          "certainty": "probable"
        }
      ],
      "description": "Рыболовные общества тихоокеанского побережья: оседлость и устойчивое неравенство, местами рабство, без земледелия. По Смиту и Коддингу (2021), неравенство связано с владением богатыми и легко защищаемыми рыбными угодьями.",
      "events": [],
      "sources": [
        {
          "ref": "smith2021"
        }
      ]
    },
    {
      "id": "haida",
      "lane": "n",
      "type": "people",
      "name": "Хайда",
      "start": {
        "year": 500,
        "dating": "conventional"
      },
      "end": null,
      "fate": "extant",
      "parents": [
        {
          "id": "nwc",
          "certainty": "probable"
        }
      ],
      "description": "Начальная дата условна. Острова Хайда-Гуаи; язык-изолят. Тотемные столбы, потлачи, дальние морские походы на каноэ.",
      "events": [],
      "sources": []
    },
    {
      "id": "tlingit",
      "lane": "n",
      "type": "people",
      "name": "Тлинкиты",
      "start": {
        "year": 500,
        "dating": "conventional"
      },
      "end": null,
      "fate": "extant",
      "parents": [
        {
          "id": "nwc",
          "certainty": "probable"
        },
        {
          "id": "nadene",
          "certainty": "probable"
        }
      ],
      "description": "Начальная дата условна. Торговцы и воины побережья Аляски; в 1802 г. уничтожили русскую крепость в Ситке, в 1804 г. русские вернули это место.",
      "events": [
        {
          "year": 1802,
          "label": "Разгром русской крепости в Ситке",
          "dating": "documented",
          "sources": []
        }
      ],
      "sources": []
    },
    {
      "id": "nadene",
      "lane": "n",
      "type": "language",
      "name": "На-дене (праязык)",
      "start": {
        "year": -3000,
        "dating": "approx"
      },
      "end": {
        "year": 1000,
        "dating": "approx"
      },
      "fate": "ended",
      "parents": [
        {
          "id": "paleo",
          "certainty": "probable"
        }
      ],
      "description": "Языки на-дене: атабаскские языки Аляски и Канады, навахо и апачей. Их предки — не отдельная волна: по Флегонтову и соавторам (2019), это смешение северной ветви коренных американцев с линией, родственной палеоэскимосам, 5–4,4 тыс. лет назад (её вклад 11–15%), вероятно на Аляске; у Морено-Майяра и соавторов (2018) — другая модель. Гипотеза дене-енисейского родства с языками Сибири обсуждается, но не доказана.",
      "events": [],
      "sources": [
        {
          "ref": "flegontov2019",
          "loc": "основной текст"
        },
        {
          "ref": "morenomayar2018",
          "loc": "основной текст"
        },
        {
          "ref": "campbell1997"
        },
        {
          "ref": "starostin2012",
          "loc": "аннотация"
        },
        {
          "ref": "vajda2010"
        }
      ]
    },
    {
      "id": "dene",
      "lane": "n",
      "type": "people",
      "name": "Северные атапаски (дене)",
      "start": {
        "year": 1000,
        "dating": "approx"
      },
      "end": null,
      "fate": "extant",
      "parents": [
        {
          "id": "nadene",
          "certainty": "established"
        }
      ],
      "description": "Множество народов внутренней Аляски и северо-запада Канады. Отсюда же ушли на юг предки навахо и апачей.",
      "events": [],
      "sources": []
    },
    {
      "id": "pesk",
      "lane": "n",
      "type": "culture",
      "name": "Палеоэскимосы (пре-дорсет → дорсет)",
      "start": {
        "year": -3000,
        "dating": "approx"
      },
      "end": {
        "year": 1300,
        "dating": "approx"
      },
      "fate": "destroyed",
      "parents": [],
      "description": "Отдельный приход из Сибири около 5 тыс. лет назад. Палеоэскимосы исчезли около 700 лет назад; в инуитских преданиях их, по-видимому, помнят как «тунит».",
      "events": [],
      "sources": [
        {
          "ref": "raghavan2014",
          "loc": "аннотация"
        },
        {
          "ref": "flegontov2019",
          "loc": "основной текст"
        },
        {
          "ref": "hnai-v05",
          "loc": "с. 553"
        }
      ]
    },
    {
      "id": "bering",
      "lane": "n",
      "type": "culture",
      "name": "Древние культуры Берингова пролива",
      "start": {
        "year": 0,
        "dating": "approx"
      },
      "end": {
        "year": 1000,
        "dating": "approx"
      },
      "fate": "ended",
      "parents": [],
      "description": "Древнеберингоморская культура, Бирнирк и др. — предки современных эскимосских народов по обе стороны пролива.",
      "events": [],
      "sources": []
    },
    {
      "id": "yupik",
      "lane": "n",
      "type": "people",
      "name": "Юпики (Аляска и Чукотка)",
      "start": {
        "year": 1000,
        "dating": "approx"
      },
      "end": null,
      "fate": "extant",
      "parents": [
        {
          "id": "bering",
          "certainty": "established"
        }
      ],
      "description": "Один из немногих коренных народов Америки, чья территория заходит в Россию: азиатские эскимосы Чукотки — юпики.",
      "events": [],
      "sources": []
    },
    {
      "id": "thule",
      "lane": "n",
      "type": "culture",
      "name": "Туле",
      "start": {
        "year": 1000,
        "dating": "approx"
      },
      "end": {
        "year": 1600,
        "dating": "conventional"
      },
      "fate": "ended",
      "parents": [
        {
          "id": "bering",
          "certainty": "established"
        }
      ],
      "description": "Культура предков инуитов. Восточнее Аляски стоянок туле раньше XIII в. нет: на восток, до Гренландии, они расселились позднее и быстрее, чем считали прежде. Палеоэскимосы к тому времени исчезали.",
      "events": [
        {
          "year": 1250,
          "label": "Расселение с Аляски на восток",
          "dating": "approx",
          "sources": [
            {
              "ref": "friesen2008",
              "loc": "аннотация"
            }
          ]
        }
      ],
      "sources": [
        {
          "ref": "friesen2008",
          "loc": "аннотация"
        },
        {
          "ref": "raghavan2014",
          "loc": "аннотация"